{
  "last_updated": "2026-04-01",
  "source": "SEC EDGAR 10-Q/10-K（2025 Q4 最新申報）",
  "note": "單位：股（非千股）。每季核對 SEC EDGAR 更新一次。",
  "shares": {
    "AAPL":  15204137000,
    "MSFT":   7433000000,
    "NVDA":  24440000000,
    "GOOGL":  5949000000,
    "AMZN":  10525000000,
    "META":   2560000000,
    "TSM":    5180000000,
    "ASML":    394000000,
    "AVGO":   4680000000,
    "AMD":    1617000000,
    "ORCL":   2750000000,
    "CRM":     968000000,
    "ADBE":    435000000,
    "CSCO":   4040000000,
    "INTC":   4260000000,
    "QCOM":   1120000000,
    "TXN":     908000000,
    "NOW":     204000000,
    "V":      2060000000,
    "MA":      924000000,
    "IBM":     906000000,
    "NFLX":    431000000,
    "UBER":   2140000000,
    "SNOW":    330000000,
    "PLTR":   2100000000
  }
}
